source,text,created_at,retweet_count,favorite_count,is_retweet,id_str,Column1
Twitter for iPhone,Will be going to Pennsylvania today in order to give my total support to RICK SACCONE running for Congress in a Special Election (March 13). Rick is a great guy. We need more Republicans to continue our already successful agenda!,1/18/2018,17299,85634,FALSE,9.54E+17,122
Twitter for iPhone,We need the Wall for the safety and security of our country. We need the Wall to help stop the massive inflow of drugs from Mexico now rated the number one most dangerous country in the world. If there is no Wall there is no Deal!,1/18/2018,29311,124070,FALSE,9.54E+17,122
Twitter for iPhone,CHIP should be part of a long term solution not a 30 Day or short term extension!,1/18/2018,12110,62752,FALSE,9.54E+17,122
Twitter for iPhone,A government shutdown will be devastating to our military...something the Dems care very little about!,1/18/2018,21966,90978,FALSE,9.54E+17,122
Twitter for iPhone,Departing Pittsburgh now where it was my great honor to stand with our incredible workers and to show the world that AMERICA is back - and we are coming back bigger and better and stronger than ever before! https://t.co/kWPgylqFzj,1/18/2018,15312,76045,FALSE,9.54E+17,122
Twitter for iPhone,AMERICA will once again be a NATION that thinks big dreams bigger and always reaches for the stars. YOU are the ones who will shape Americaƒ??s destiny. YOU are the ones who will restore our prosperity. And YOU are the ones who are MAKING AMERICA GREAT AGAIN! #MAGA https://t.co/f2abNK47II,1/18/2018,26240,103585,FALSE,9.54E+17,122
Twitter for iPhone,House of Representatives needs to pass Government Funding Bill tonight. So important for our country - our Military needs it!,1/18/2018,20416,102080,FALSE,9.54E+17,122
Twitter for iPhone,Government Funding Bill past last night in the House of Representatives. Now Democrats are needed if it is to pass in the Senate - but they want illegal immigration and weak borders. Shutdown coming? We need more Republican victories in 2018!,1/19/2018,26110,110987,FALSE,9.54E+17,122
Twitter for iPhone,.@WhiteHouse Briefing with Director Marc Short and Director Mick Mulvaney...https://t.co/0O0VsYXmHB,1/19/2018,8564,44108,FALSE,9.54E+17,122
Twitter for iPhone,ƒ??Shutting down the government is a very serious thing. People die accidents happen. I donƒ??t know how I would vote right now on a CR OK?ƒ?Sen. Dianne Feinstein (D-Calif)https://t.co/7xP3CBnv5j,1/19/2018,15651,49735,FALSE,9.54E+17,122
Twitter for iPhone,Today I was honored and proud to address the 45th Annual @March_for_Life! You are living witnesses of this yearƒ??s March for Life theme: #LoveSavesLives. https://t.co/DMST4qhDmp,1/19/2018,25081,96877,FALSE,9.54E+17,122
Twitter for iPhone,Just signed 702 Bill to reauthorize foreign intelligence collection. This is NOT the same FISA law that was so wrongly abused during the election. I will always do the right thing for our country and put the safety of the American people first!,1/19/2018,28082,129151,FALSE,9.54E+17,122
Twitter for iPhone,Excellent preliminary meeting in Oval with @SenSchumer - working on solutions for Security and our great Military together with @SenateMajLdr McConnell and @SpeakerRyan. Making progress - four week extension would be best!,1/19/2018,13138,65007,FALSE,9.54E+17,122
Twitter for iPhone,Not looking good for our great Military or Safety &amp; Security on the very dangerous Southern Border. Dems want a Shutdown in order to help diminish the great success of the Tax Cuts and what they are doing for our booming economy.,1/20/2018,31457,117670,FALSE,9.55E+17,122
Twitter for iPhone,Democrats are far more concerned with Illegal Immigrants than they are with our great Military or Safety at our dangerous Southern Border. They could have easily made a deal but decided to play Shutdown politics instead. #WeNeedMoreRepublicansIn18 in order to power through mess!,1/20/2018,42612,145344,FALSE,9.55E+17,122
Twitter for iPhone,This is the One Year Anniversary of my Presidency and the Democrats wanted to give me a nice present. #DemocratShutdown,1/20/2018,30695,124222,FALSE,9.55E+17,122
Twitter for iPhone,For those asking the Republicans only have 51 votes in the Senate and they need 60. That is why we need to win more Republicans in 2018 Election! We can then be even tougher on  Crime (and Border) and even better to our Military &amp; Veterans!,1/20/2018,40265,155084,FALSE,9.55E+17,122
Twitter for iPhone,#AMERICA FIRST!,1/20/2018,31872,123740,FALSE,9.55E+17,122
Twitter for iPhone,Democrats are holding our Military hostage over their desire to have unchecked illegal immigration. Canƒ??t let that happen!,1/20/2018,44943,168968,FALSE,9.55E+17,122
Twitter for iPhone,Beautiful weather all over our great country a perfect day for all Women to March. Get out there now to celebrate the historic milestones and unprecedented economic success and wealth creation that has taken place over the last 12 months. Lowest female unemployment in 18 years!,1/20/2018,53725,209710,FALSE,9.55E+17,122
Twitter for iPhone,Unprecedented success for our Country in so many ways since the Election. Record Stock Market Strong on Military Crime Borders &amp; ISIS Judicial Strength &amp; Numbers Lowest Unemployment for Women &amp; ALL Massive Tax Cuts end of Individual Mandate - and so much more. Big 2018!,1/20/2018,29055,130892,FALSE,9.55E+17,122
Twitter for iPhone,RT @realDonaldTrump: Democrats are far more concerned with Illegal Immigrants than they are with our great Military or Safety at our dangerƒ??,1/21/2018,42614,0,TRUE,9.55E+17,123
Twitter for iPhone,The Trump Administration has terminated more UNNECESSARY Regulation in just twelve months than any other Administration has terminated during their full term in office no matter what the length. The good news is THERE IS MUCH MORE TO COME!,1/21/2018,31921,154853,FALSE,9.55E+17,123
Twitter for iPhone,Eric Trump on @JudgeJeanine on @FoxNews now!,1/21/2018,6389,46706,FALSE,9.55E+17,123
Twitter for iPhone,"RT @FoxNews: .@EricTrump: ""People have seen a year that's incredible that's been filled with nothing but the best for our country Americaƒ??",1/21/2018,7391,0,TRUE,9.55E+17,123
Twitter for iPhone,"RT @FoxNews: .@davidwebbshow: ""Let's look at the calendar. It's January 20th. DACA expires on March 5th. That means this was a construct ofƒ??",1/21/2018,13166,0,TRUE,9.55E+17,123
Twitter for iPhone,"RT @FoxNews: .@KellyannePolls: ""Since @POTUS took office 863000 new jobs were filled by women. Over half a million American women have enƒ??",1/21/2018,14559,0,TRUE,9.55E+17,123
Twitter for iPhone,"RT @FoxNews: .@EricTrump: ""My father was elected for one reason and that's because he actually believes in putting America first which isƒ??",1/21/2018,14414,0,TRUE,9.55E+17,123
Twitter for iPhone,RT @realDonaldTrump: Democrats are holding our Military hostage over their desire to have unchecked illegal immigration. Canƒ??t let that hapƒ??,1/21/2018,44891,0,TRUE,9.55E+17,123
Twitter for iPhone,Great to see how hard Republicans are fighting for our Military and Safety at the Border. The Dems just want illegal immigrants to pour into our nation unchecked. If stalemate continues Republicans should go to 51% (Nuclear Option) and vote on real long term budget no C.R.ƒ??s!,1/21/2018,47818,178941,FALSE,9.55E+17,123
Twitter for iPhone,Thank you to Brad Blakeman on @FoxNews for grading year one of my presidency with an ƒ??Aƒ?-and likewise to Doug Schoen for the very good grade and statements. Working hard!,1/22/2018,23749,127050,FALSE,9.55E+17,123
Twitter for iPhone,The Democrats are turning down services and security for citizens in favor of services and security for non-citizens. Not good!,1/22/2018,33480,132396,FALSE,9.55E+17,123
Twitter for iPhone,Democrats have shut down our government in the interests of their far left base. They donƒ??t want to do it but are powerless!,1/22/2018,22345,109898,FALSE,9.55E+17,123
Twitter for iPhone,End the Democrats Obstruction! https://t.co/tzBXilvW1b,1/22/2018,21781,93311,FALSE,9.55E+17,123
Twitter for iPhone,Big win for Republicans as Democrats cave on Shutdown. Now I want a big win for everyone including Republicans Democrats and DACA but especially for our Great Military and Border Security. Should be able to get there. See you at the negotiating table!,1/23/2018,28224,133812,FALSE,9.56E+17,123
Twitter for iPhone,Even Crazy Jim Acosta of Fake News CNN agrees: ƒ??Trump World and WH sources dancing in end zone: Trump wins again...Schumer and Dems caved...gambled and lost.ƒ? Thank you for your honesty Jim!,1/23/2018,27462,129596,FALSE,9.56E+17,123
Twitter for iPhone,In one of the biggest stories in a long time the FBI says it is now missing five months worth of lovers Strzok - Page texts perhaps 50000 all in prime time. Wow!,1/23/2018,1115,3377,FALSE,9.56E+17,123
Twitter for iPhone,In one of the biggest stories in a long time the FBI now says it is missing five months worth of lovers Strzok-Page texts perhaps 50000 and all in prime time. Wow!,1/23/2018,36971,134949,FALSE,9.56E+17,123
Twitter for iPhone,Nobody knows for sure that the Republicans &amp; Democrats will be able to reach a deal on DACA by February 8 but everyone will be trying....with a big additional focus put on Military Strength and Border Security. The Dems have just learned that a Shutdown is not the answer!,1/23/2018,24229,112958,FALSE,9.56E+17,123
Twitter for iPhone,Thank you to General John Kelly who is doing a fantastic job and all of the Staff and others in the White House for a job well done. Long hours and Fake reporting makes your job more difficult but it is always great to WIN and few have won more than us!,1/23/2018,21698,97892,FALSE,9.56E+17,123
Twitter for iPhone,Where are the 50000 important text messages between FBI lovers Lisa Page and Peter Strzok?  Blaming Samsung!,1/24/2018,32286,127998,FALSE,9.56E+17,124
Twitter for iPhone,Cryinƒ?? Chuck Schumer fully understands especially after his humiliating defeat that if there is no Wall there is no DACA. We must have safety and security together with a strong Military for our great people!,1/24/2018,36887,155261,FALSE,9.56E+17,124
Twitter for iPhone,Tremendous investment by companies from all over the world being made in America. There has never been anything like it. Now Disney J.P. Morgan Chase and many others. Massive Regulation Reduction and Tax Cuts are making us a powerhouse again. Long way to go! Jobs Jobs Jobs!,1/24/2018,33406,147591,FALSE,9.56E+17,124
Twitter for iPhone,Earlier today I spoke with @GovMattBevin of Kentucky regarding yesterdayƒ??s shooting at Marshall County High School. My thoughts and prayers are with Bailey Holt Preston Cope their families and all of the wounded victims who are in recovery. We are with you!,1/24/2018,19372,98925,FALSE,9.56E+17,124
Media Studio,It was my great honor to welcome Mayorƒ??s from across America to the WH. My Administration will always support local government - and listen to the leaders who know their communities best. Together we will usher in a bold new era of Peace and Prosperity! https://t.co/dmYECTnk0a https://t.co/RSv7V7r0DT,1/24/2018,16891,79440,FALSE,9.56E+17,124
Twitter for iPhone,Will soon be heading to Davos Switzerland to tell the world how great America is and is doing. Our economy is now booming and with all I am doing will only get better...Our country is finally WINNING again!,1/25/2018,28521,153096,FALSE,9.56E+17,124
Twitter for iPhone,Great bilateral meeting with Prime Minister Theresa May of the United Kingdom affirming the special relationship and our commitment to work together on key national security challenges and economic opportunities. #WEF18 https://t.co/FPP8aRDAyt,1/25/2018,16111,76560,FALSE,9.57E+17,124
Twitter for iPhone,Very productive bilateral meeting with Prime Minister Benjamin @Netanyahu of Israel - in Davos Switzerland! #WEF18 https://t.co/2sZM9YI7tJ,1/25/2018,15210,73018,FALSE,9.57E+17,124
Twitter for iPhone,Today Americans everywhere remember the brave men and women of @NASA who lost their lives in our Nationƒ??s eternal quest to expand the boundaries of human potential. https://t.co/clBsJTGz8B https://t.co/jTJkusdBQA,1/25/2018,17824,84228,FALSE,9.57E+17,124
Twitter for iPhone,Will be interviewed on  @SquawkCNBC by @JoeSquawk coming up at 6:00amE from Davos Switzerland. Enjoy! #WEF18 https://t.co/7egYlxnFBd,1/26/2018,6604,36719,FALSE,9.57E+17,124
Twitter for iPhone,It was an honor to meet with Republic of Rwanda President Paul Kagame this morning in Davos Switzerland. Many great discussions! #WEF18 https://t.co/SaPzwVhDiB,1/26/2018,12518,63689,FALSE,9.57E+17,124
Twitter for iPhone,Great bilateral meeting with President @Alain_Berset of the Swiss Confederation - as we continue to strengthen our great friendship. Such an honor to be in Switzerland! #WEF18 https://t.co/87pLrCpQkZ,1/26/2018,10795,55881,FALSE,9.57E+17,124
Twitter for iPhone,Join me live at the 2018 World Economic Forum in Davos Switzerland! #WEF18 https://t.co/fdHejCmv73 https://t.co/DuKJlVTWB8,1/26/2018,10132,52421,FALSE,9.57E+17,124
Twitter for iPhone,Heading back from a very exciting two days in Davos Switzerland. Speech on Americaƒ??s economic revival was well received. Many of the people I met will be investing in the U.S.A.! #MAGA,1/26/2018,22686,112306,FALSE,9.57E+17,124
Twitter for iPhone,DACA has been made increasingly difficult by the fact that Cryinƒ?? Chuck Schumer took such a beating over the shutdown that he is unable to act on immigration!,1/26/2018,26389,119475,FALSE,9.57E+17,124
Twitter for iPhone,Thank you for the wonderful welcome @WEF! #Davos2018 https://t.co/IQkoQJxR5B,1/26/2018,16392,72341,FALSE,9.57E+17,124
Twitter for iPhone,Thank you to Brandon Judd of the National Border Patrol Council for his strong statement on @foxandfriends that we very badly NEED THE WALL. Must also end loophole of ƒ??catch &amp; releaseƒ? and clean up the legal and other procedures at the border NOW for Safety &amp; Security reasons.,1/27/2018,29292,124248,FALSE,9.57E+17,125
Twitter for iPhone,On Holocaust Remembrance Day we mourn and grieve the murder of 6 million innocent Jewish men women and children and the millions of others who perished in the evil Nazi Genocide. We pledge with all of our might and resolve: Never Again! https://t.co/PfHM7UiZ0C https://t.co/25W0SZHTOu,1/27/2018,25987,107944,FALSE,9.57E+17,125
Twitter for iPhone,Taliban targeted innocent Afghans brave police in Kabul today. Our thoughts and prayers go to the victims and first responders. We will not allow the Taliban to win!,1/27/2018,22155,114304,FALSE,9.57E+17,125
Twitter for iPhone,I have offered DACA a wonderful deal including a doubling in the number of recipients &amp; a twelve year pathway to citizenship for two reasons: (1) Because the Republicans want to fix a long time terrible problem. (2) To show that Democrats do not want to solve DACA only use it!,1/28/2018,47047,175856,FALSE,9.57E+17,125
Twitter for iPhone,Democrats are not interested in Border Safety &amp; Security or in the funding and rebuilding of our Military. They are only interested in Obstruction!,1/28/2018,35964,157413,FALSE,9.57E+17,125
Twitter for iPhone,Somebody please inform Jay-Z that because of my policies Black Unemployment has just been reported to be at the LOWEST RATE EVER RECORDED!,1/28/2018,64122,240489,FALSE,9.58E+17,125
Twitter for iPhone,Our economy is better than it has been in many decades. Businesses are coming back to America like never before. Chrysler as an example is leaving Mexico and coming back to the USA. Unemployment is nearing record lows. We are on the right track!,1/28/2018,42337,199787,FALSE,9.58E+17,125
Twitter for iPhone,Congratulations to Americaƒ??s new Secretary of @HHSGov Alex Azar! https://t.co/Y9inQaCt7o,1/29/2018,16431,84209,FALSE,9.58E+17,125
Twitter for iPhone,Join me live for the #SOTUhttps://t.co/0SLktWxfHi,1/31/2018,22023,109076,FALSE,9.59E+17,126
Twitter for iPhone,Heading to beautiful West Virginia to be with great members of the Republican Party. Will be planning Infrastructure and discussing Immigration and DACA not easy when we have no support from the Democrats. NOT ONE DEM VOTED FOR OUR TAX CUT BILL! Need more Republicans in ƒ??18.,2/1/2018,28485,138117,FALSE,9.59E+17,126
Twitter for iPhone,March 5th is rapidly approaching and the Democrats are doing nothing about DACA. They Resist Blame Complain and Obstruct - and do nothing. Start pushing Nancy Pelosi and the Dems to work out a DACA fix NOW!,2/1/2018,29920,123474,FALSE,9.59E+17,126
Twitter for iPhone,Thank you for all of the nice compliments and reviews on the State of the Union speech. 45.6 million people watched the highest number in history. @FoxNews beat every other Network for the first time ever with 11.7 million people tuning in. Delivered from the heart!,2/1/2018,37362,184812,FALSE,9.59E+17,126
Twitter for iPhone,The Democrats just arenƒ??t calling about DACA. Nancy Pelosi and Chuck Schumer have to get moving fast or theyƒ??ll disappoint you again. We have a great chance to make a deal or blame the Dems! March 5th is coming up fast.,2/2/2018,28843,124250,FALSE,9.59E+17,127
Twitter for iPhone,The top Leadership and Investigators of the FBI and the Justice Department have politicized the sacred investigative process in favor of Democrats and against Republicans - something which would have been unthinkable just a short time ago. Rank &amp; File are great people!,2/2/2018,40439,139322,FALSE,9.59E+17,127
Twitter for iPhone,ƒ??You had Hillary Clinton and the Democratic Party try to hide the fact that they gave money to GPS Fusion to create a Dossier which was used by their allies in the Obama Administration to convince a Court misleadingly by all accounts to spy on the Trump Team.ƒ? Tom Fitton JW,2/2/2018,52193,161884,FALSE,9.59E+17,127
Twitter for iPad,With 3.5 million Americans receiving bonuses or other benefits from their employers as a result of TAX CUTS 2018 is off to great start!ƒ??Unemployment rate at 4.1%.ƒ??Average earnings up 2.9% in the last year.ƒ??200000 new American jobs.ƒ??#MAGA???§???? https://t.co/upqSvBhRqJ,2/2/2018,27604,108146,FALSE,9.59E+17,127
Twitter for iPad,ƒ??Trump the orator outlines the greatness of America to Democratsƒ?? disgustƒ? https://t.co/XpirrtTY6V,2/2/2018,17672,77697,FALSE,9.59E+17,127
Twitter for iPad,Today it was my honor to join the great men and women of @DHSgov @CustomsBorder @ICEgov and @USCIS at the U.S. Customs and Border Protection National Targeting Center in Sterling Virginia. Fact sheet: https://t.co/Q027Wgdzdo https://t.co/NecuA0y1Sk,2/2/2018,14643,71009,FALSE,9.60E+17,127
Twitter for iPhone,RT @EricTrump: ???§???????§???????§???? https://t.co/iszxYp036c,2/3/2018,12338,0,TRUE,9.60E+17,127
Twitter for iPhone,RT @EricTrump: #MakeAmericaGreatAgain ???§???????§???????§???? https://t.co/CJts3udtNO,2/3/2018,12755,0,TRUE,9.60E+17,127
Twitter for iPhone,Rasmussen just announced that my approval rating jumped to 49% a far better number than I had in winning the Election and higher than certain ƒ??sacred cows.ƒ? Other Trump polls are way up also. So why does the media refuse to write this? Oh well someday!,2/3/2018,34992,156630,FALSE,9.60E+17,127
Twitter for iPhone,This memo totally vindicates ƒ??Trumpƒ? in probe. But the Russian Witch Hunt goes on and on. Their was no Collusion and there was no Obstruction (the word now used because after one year of looking endlessly and finding NOTHING collusion is dead). This is an American disgrace!,2/3/2018,39282,141909,FALSE,9.60E+17,127
Twitter for iPhone,Great jobs numbers and finally after many years rising wages- and nobody even talks about them. Only Russia Russia Russia despite the fact that after a year of looking there is No Collusion!,2/4/2018,30276,136102,FALSE,9.60E+17,127
Twitter for iPhone,ƒ??The four page memo released Friday reports the disturbing fact about how the FBI and FISA appear to have been used to influence the 2016 election and its aftermath....The FBI failed to inform the FISA court that the Clinton campaign had funded the dossier....the FBI became....,2/4/2018,37037,130687,FALSE,9.60E+17,127
Twitter for iPhone,...a tool of anti-Trump political actors. This is unacceptable in a democracy and ought to alarm anyone who wants the FBI to be a nonpartisan enforcer of the law....The FBI wasnƒ??t straight with Congress as it hid most of these facts from investigators.ƒ? Wall Street Journal,2/4/2018,35940,130832,FALSE,9.60E+17,127
Twitter for iPhone,My thoughts and prayers are with all of the victims involved in this mornings train collision in South Carolina. Thank you to our incredible First Responders for the work theyƒ??ve done!,2/4/2018,22937,141922,FALSE,9.60E+17,127
Twitter for iPhone,Congratulations to the Philadelphia Eagles on a great Super Bowl victory!,2/5/2018,36253,212429,FALSE,9.60E+17,128
Twitter for iPhone,The Democrats are pushing for Universal HealthCare while thousands of people are marching in the UK because their U system is going broke and not working. Dems want to greatly raise taxes for really bad and non-personal medical care. No thanks!,2/5/2018,30625,120989,FALSE,9.60E+17,128
Twitter for iPhone,Thank you to @foxandfriends for exposing the truth. Perhaps thatƒ??s why your ratings are soooo much better than your untruthful competition!,2/5/2018,22763,107638,FALSE,9.60E+17,128
Twitter for iPhone,Little Adam Schiff who is desperate to run for higher office is one of the biggest liars and leakers in Washington right up there with Comey Warner Brennan and Clapper! Adam leaves closed committee hearings to illegally leak confidential information. Must be stopped!,2/5/2018,43004,142317,FALSE,9.60E+17,128
Twitter for iPhone,Any deal on DACA that does not include STRONG border security and the desperately needed WALL is a total waste of time. March 5th is rapidly approaching and the Dems seem not to care about DACA. Make a deal!,2/5/2018,30023,123371,FALSE,9.61E+17,128
Twitter for iPhone,Representative Devin Nunes a man of tremendous courage and grit may someday be recognized as a Great American Hero for what he has exposed and what he has had to endure!,2/5/2018,35787,133744,FALSE,9.61E+17,128
Twitter for iPhone,Thanks to the historic TAX CUTS that I signed into law your paychecks are going way UP your taxes are going way DOWN and America is once again OPEN FOR BUSINESS! https://t.co/GISFbDDGXX,2/5/2018,22886,105977,FALSE,9.61E+17,128
Twitter for iPhone,So disgraceful that a person illegally in our country killed @Colts linebacker Edwin Jackson. This is just one of many such preventable tragedies. We must get the Dems to get tough on the Border and with illegal immigration FAST!,2/6/2018,36136,142978,FALSE,9.61E+17,128
Twitter for iPhone,My prayers and best wishes are with the family of Edwin Jackson a wonderful young man whose life was so senselessly taken. @Colts,2/6/2018,20956,104741,FALSE,9.61E+17,128
Twitter for iPhone,Polling shows nearly 7 in 10 Americans support an immigration reform package that includes DACA fully secures the border ends chain migration &amp; cancels the visa lottery. If Dƒ??s oppose this deal they arenƒ??t serious about DACA-they just want open borders. https://t.co/XDMcDOr9vM,2/6/2018,23645,89740,FALSE,9.61E+17,128
Twitter for iPhone,We need a 21st century MERIT-BASED immigration system.  Chain migration and the visa lottery are outdated programs that hurt our economic and national security. https://t.co/rP9Gtr2E5N,2/6/2018,25680,92746,FALSE,9.61E+17,128
Media Studio,Today we heard the experiences of law enforcement professionals and community leaders working to combat the threat of MS-13 and the reforms we need from Congress to defeat it. Watch here: https://t.co/VPMTnko7Ik https://t.co/4OaXXuj9Va,2/6/2018,18392,76121,FALSE,9.61E+17,128
Twitter for iPhone,HAPPY BIRTHDAY to our 40th President of the United States of America Ronald Reagan! https://t.co/JtEglBhm4c,2/7/2018,33058,181719,FALSE,9.61E+17,128
Twitter for iPhone,Congratulations @ElonMusk and @SpaceX on the successful #FalconHeavy launch. This achievement along with @NASAƒ??s commercial and international partners continues to show American ingenuity at its best! https://t.co/eZfLSpyJPK,2/7/2018,31726,167618,FALSE,9.61E+17,128
Twitter for iPhone,In the ƒ??old daysƒ? when good news was reported the Stock Market would go up. Today when good news is reported the Stock Market goes down. Big mistake and we have so much good (great) news about the economy!,2/7/2018,22005,112672,FALSE,9.61E+17,128
Twitter for iPhone,NEW FBI TEXTS ARE BOMBSHELLS!,2/7/2018,39864,138202,FALSE,9.61E+17,128
Media Studio,Best wishes to the Republic of Korea on hosting the @Olympics! What a wonderful opportunity to show everyone that you are a truly GREAT NATION! https://t.co/aboM2Up48y,2/7/2018,12803,65509,FALSE,9.61E+17,128
Media Studio,Congratulations to the Republic of Korea on what will be a MAGNIFICENT Winter Olympics! What the South Korean people have built is truly an inspiration! https://t.co/giN2B1h6Ph,2/7/2018,13349,70576,FALSE,9.61E+17,128
Twitter for iPhone,The Budget Agreement today is so important for our great Military. It ends the dangerous sequester and gives Secretary Mattis what he needs to keep America Great. Republicans and Democrats must support our troops and support this Bill!,2/7/2018,23230,109471,FALSE,9.61E+17,128
Twitter for iPhone,Will be heading over shortly to make remarks at The National Prayer Breakfast in Washington. Great religious and political leaders and many friends including T.V. producer Mark Burnett of our wonderful 14 season Apprentice triumph will be there. Looking forward to seeing all!,2/8/2018,17876,106381,FALSE,9.62E+17,129
