source,text,created_at,retweet_count,favorite_count,is_retweet,id_str,Column1
Twitter for iPhone,"Rand Paul or whoever votes against Hcare Bill will forever (future political campaigns) be known as ""the Republican who saved ObamaCare.""",9/22/2017,14476,61009,FALSE,9.11E+17,82
Twitter for iPhone,Kim Jong Un of North Korea who is obviously a madman who doesn't mind starving or killing his people will be tested like never before!,9/22/2017,41831,130442,FALSE,9.11E+17,82
Twitter for iPhone,Thank you! https://t.co/hlz48RLkIf,9/22/2017,10934,56418,FALSE,9.11E+17,82
Twitter for iPhone,RT @TwitterData: These are the 10 most Tweeted about world leaders during the first day of #UNGA General Debate https://t.co/HhlOlNAkDJ,9/22/2017,5407,0,TRUE,9.11E+17,82
Twitter for iPhone,RT @DonnaWR8: .@POTUS #TRUMP???§???? &amp; @FLOTUS???§When ALL seemed HOPELESS...YOU brought HOPE!You INSPIRE us ALL!#MAGA #Harvey @Scavino45 #USAƒ??,9/22/2017,8452,0,TRUE,9.11E+17,82
Twitter for iPhone,The Russia hoax continues now it's ads on Facebook. What about the totally biased and dishonest Media coverage in favor of Crooked Hillary?,9/22/2017,26853,105163,FALSE,9.11E+17,82
Twitter for iPhone,"The greatest influence over our election was the Fake News Media ""screaming"" for Crooked Hillary Clinton. Next she was a bad candidate!",9/22/2017,19652,90167,FALSE,9.11E+17,82
Twitter for iPhone,Will be in Alabama tonight. Luther Strange has gained mightily since my endorsement but will be very close. He loves Alabama and so do I!,9/22/2017,7407,45937,FALSE,9.11E+17,82
Twitter for iPhone,#USAatUNGA???§????#UNGA https://t.co/miT2Lj7Q90,9/22/2017,9198,40194,FALSE,9.11E+17,82
Twitter for iPhone,Thank you to Doug Parker and American Airlines for all of the help you have given to the U.S. with Hurricane flights. Fantastic job!,9/22/2017,13534,78605,FALSE,9.11E+17,82
Twitter for iPhone,Heading to Alabama now big crowd!,9/22/2017,8188,60818,FALSE,9.11E+17,82
Twitter for iPhone,John McCain never had any intention of voting for this Bill which his Governor loves. He campaigned on Repeal &amp; Replace. Let Arizona down!,9/23/2017,22206,86966,FALSE,9.12E+17,83
Twitter for iPhone,Arizona had a 116% increase in ObamaCare premiums last year with deductibles very high. Chuck Schumer sold John McCain a bill of goods. Sad,9/23/2017,16391,66300,FALSE,9.12E+17,83
Twitter for iPhone,Large Block Grants to States is a good thing to do. Better control &amp;  management. Great for Arizona. McCain let his best friend L.G. down!,9/23/2017,10820,54685,FALSE,9.12E+17,83
Twitter for iPhone,I know Rand Paul and I think he may find a way to get there for the good of the Party!,9/23/2017,10486,58235,FALSE,9.12E+17,83
Twitter for iPhone,Alaska had a 200% plus increase in premiums under ObamaCare worst in the country. Deductibles high people angry! Lisa M comes through.,9/23/2017,15000,64703,FALSE,9.12E+17,83
Twitter for iPhone,It was great being with Luther Strange last night in Alabama. What great people what a crowd! Vote Luther on Tuesday.,9/23/2017,7047,45124,FALSE,9.12E+17,83
Twitter for iPhone,Going to the White House is considered a great honor for a championship team.Stephen Curry is hesitatingtherefore invitation is withdrawn!,9/23/2017,64839,214319,FALSE,9.12E+17,83
Twitter for iPhone,If a player wants the privilege of making millions of dollars in the NFLor other leagues he or she should not be allowed to disrespect....,9/23/2017,47642,184086,FALSE,9.12E+17,83
Twitter for iPhone,...our Great American Flag (or Country) and should stand for the National Anthem. If not YOU'RE FIRED. Find something else to do!,9/23/2017,42328,161691,FALSE,9.12E+17,83
Twitter for iPhone,Very proud of our incredible First Lady (@FLOTUS.) She is a truly great representative for our country! https://t.co/yFv0WIjgby,9/23/2017,18622,102882,FALSE,9.12E+17,83
Twitter for iPhone,Iran just test-fired a Ballistic Missile capable of reaching Israel.They are also working with North Korea.Not much of an agreement we have!,9/23/2017,29011,98305,FALSE,9.12E+17,83
Twitter for iPhone,"Democrats are laughingly saying that McCain had a ""moment of courage."" Tell that to the people of Arizona who were deceived. 116% increase!",9/23/2017,26945,105470,FALSE,9.12E+17,83
Twitter for iPhone,Roger Goodell of NFL just put out a statement trying to justify the total disrespect certain players show to our country.Tell them to stand!,9/23/2017,40988,156381,FALSE,9.12E+17,83
Twitter for iPhone,Just heard Foreign Minister of North Korea speak at U.N. If he echoes thoughts of Little Rocket Man they won't be around much longer!,9/24/2017,37580,135288,FALSE,9.12E+17,83
Twitter for iPhone,If NFL fans refuse to go to games until players stop disrespecting our Flag &amp; Country you will see change take place fast. Fire or suspend!,9/24/2017,45225,179990,FALSE,9.12E+17,83
Twitter for iPhone,...NFL attendance and ratings are WAY DOWN. Boring games yes but many stay away because they love our country. League should back U.S.,9/24/2017,33746,157524,FALSE,9.12E+17,83
Twitter for iPhone,Great solidarity for our National Anthem and for our Country. Standing with locked arms is good kneeling is not acceptable. Bad ratings!,9/24/2017,27692,135710,FALSE,9.12E+17,83
Twitter for iPhone,Please to inform that the Champion Pittsburgh Penguins of the NHL will be joining me at the White House for Ceremony. Great team!,9/24/2017,33790,162345,FALSE,9.12E+17,83
Twitter for iPhone,RT @DonnaWR8: @realDonaldTrump You can boycott our anthem WE CAN BOYCOTT YOU! #NFL #MAGA https://t.co/ryYzZnXjXE,9/24/2017,20639,0,TRUE,9.12E+17,83
Twitter for iPhone,RT @DonnaWR8: @realDonaldTrump I wonder what this BRAVE American would give to stand on his OWN two legs just ONCE MORE for our #Anthem?ƒ??,9/24/2017,22730,0,TRUE,9.12E+17,83
Twitter for iPhone,Courageous Patriots have fought and died for our great American Flag --- we MUST honor and respect it!  MAKE AMERICA GREAT AGAIN!,9/24/2017,52950,199204,FALSE,9.12E+17,83
Twitter for iPhone,Alaska Arizona Maine and Kentucky are big winners in the Healthcare proposal. 7 years of Repeal &amp; Replace and some Senators not there.,9/24/2017,12571,63341,FALSE,9.12E+17,83
Twitter for iPhone,Sports fans should never condone players that do not stand proud for their National Anthem or their Country. NFL should change policy!,9/24/2017,40390,174275,FALSE,9.12E+17,83
Twitter for iPhone,Making America Safe is my number one priority. We will not admit those into our country we cannot safely vet.https://t.co/KJ886okyfC,9/24/2017,23365,99043,FALSE,9.12E+17,83
Twitter for iPhone,So proud of NASCAR and its supporters and fans. They won't put up with disrespecting our Country or our Flag - they said it loud and clear!,9/25/2017,36250,173313,FALSE,9.12E+17,83
Twitter for iPhone,Many people booed the players who kneeled yesterday (which was a small percentage of total). These are fans who demand respect for our Flag!,9/25/2017,24597,137858,FALSE,9.12E+17,83
Twitter for iPhone,The issue of kneeling has nothing to do with race. It is about respect for our Country Flag and National Anthem. NFL must respect this!,9/25/2017,56083,206672,FALSE,9.12E+17,83
Twitter for iPhone,The White House never looked more beautiful than it did returning last night. Important meetings taking place today. Big tax cuts &amp; reform.,9/25/2017,14142,84347,FALSE,9.12E+17,83
Twitter for iPhone,#StandForOurAnthem,9/25/2017,74410,207402,FALSE,9.12E+17,83
Twitter for iPhone,RT @jayMAGA45: NFLplayer PatTillman joined U.S. Army in 2002. He was killed in action 2004. He fought 4our country/freedom. #StandForOurAntƒ??,9/25/2017,21651,0,TRUE,9.12E+17,83
Twitter for iPhone,.@CNN is #FakeNews. Just reported COS (John Kelly) was opposed to my stance on NFL players disrespecting FLAG ANTHEM COUNTRY. Total lie!,9/25/2017,17397,65726,FALSE,9.12E+17,83
Twitter for iPhone,General John Kelly totally agrees w/ my stance on NFL players and the fact that they should not be disrespecting our FLAG or GREAT COUNTRY!,9/25/2017,22128,107087,FALSE,9.12E+17,83
Twitter for iPhone,Tremendous backlash against the NFL and its players for disrespect of our Country.#StandForOurAnthem???§????,9/25/2017,27035,112130,FALSE,9.12E+17,83
Twitter for iPhone,Texas &amp; Florida are doing great but Puerto Rico which was already suffering from broken infrastructure &amp; massive debt is in deep trouble..,9/26/2017,13539,58093,FALSE,9.12E+17,84
Twitter for iPhone,...It's old electrical grid which was in terrible shape was devastated. Much of the Island was destroyed with billions of dollars....,9/26/2017,9115,43305,FALSE,9.12E+17,84
Twitter for iPhone,...owed to Wall Street and the banks which sadly must be dealt with. Food water and medical are top priorities - and doing well. #FEMA,9/26/2017,8343,40493,FALSE,9.12E+17,84
Media Studio,A few of the many clips of John McCain talking about Repealing &amp; Replacing O'Care. My oh my has he changed-complete turn from years of talk! https://t.co/t9cXG2Io86,9/26/2017,29849,78278,FALSE,9.12E+17,84
Twitter for iPhone,Big election tomorrow in the Great State of Alabama. Vote for Senator Luther Strange tough on crime &amp; border - will never let you down!,9/26/2017,7432,42817,FALSE,9.12E+17,84
Twitter for iPhone,Ratings for NFL football are way down except before game starts when people tune in to see whether or not our country will be disrespected!,9/26/2017,18510,90392,FALSE,9.13E+17,84
Twitter for iPhone,The booing at the NFL football game last night when the entire Dallas team dropped to its knees was loudest I have ever heard. Great anger,9/26/2017,22527,113676,FALSE,9.13E+17,84
Twitter for iPhone,...But while Dallas dropped to it knees as a team they ALL stood up for our National Anthem. Big progress being made - we love our country!,9/26/2017,478,1969,FALSE,9.13E+17,84
Twitter for iPhone,But while Dallas dropped to its knees as a team they all stood up for our National Anthem. Big progress being made-we all love our country!,9/26/2017,15275,85702,FALSE,9.13E+17,84
Twitter for iPhone,"Luther Strange has been shooting up in the Alabama polls since my endorsement. Finish the job - vote today for ""Big Luther.""",9/26/2017,4884,29142,FALSE,9.13E+17,84
Twitter for iPhone,Great interview on @foxandfriends with the parents of Otto Warmbier: 1994 - 2017. Otto was tortured beyond belief by North Korea.,9/26/2017,12494,50076,FALSE,9.13E+17,84
Twitter for iPhone,Thank you to Carmen Yulin Cruz the Mayor of San Juan for your kind words on FEMA etc.We are working hard. Much food and water there/on way,9/26/2017,14099,67522,FALSE,9.13E+17,84
Twitter for iPhone,The NFL has all sorts of rules and regulations. The only way out for them is to set a rule that you can't kneel during our National Anthem!,9/26/2017,19704,89132,FALSE,9.13E+17,84
Twitter for iPhone,ALABAMA get out and vote for Luther Strange - he has proven to me that he will never let you down! #MAGA,9/26/2017,4968,27784,FALSE,9.13E+17,84
Twitter for iPhone,Honored to welcome Republican and Democrat members of the House Ways and Means Committee to the White House today! #USA???§???? https://t.co/nWnX9CDP0d,9/26/2017,6989,37898,FALSE,9.13E+17,84
Twitter for iPhone,RT @ricardorossello: Briefed @POTUS @realDonaldTrump in #SituationRoom and thanked him for his leadership quick response &amp; commitment to oƒ??,9/26/2017,8302,0,TRUE,9.13E+17,84
Twitter for iPhone,Heading over to the @UN to meet with Ambassador @NikkiHaley and all of her great representatives! #USA???§????,9/26/2017,6984,43553,FALSE,9.13E+17,84
Media Studio,America's hearts &amp; prayers are with the people of #PuertoRico &amp; the #USVI. We will get through this - and we will get through this TOGETHER! https://t.co/NcmsF4Fqpr,9/26/2017,10629,46722,FALSE,9.13E+17,84
Media Studio,I want to express our support and extend our prayers to all those affected by the vile terror attack in Spain last month. ???§???????¦???? https://t.co/5mT0QXFlnL,9/26/2017,8658,46986,FALSE,9.13E+17,84
Media Studio,It was an honor to welcome President @MarianoraJoy of Spain. Thank you for standing w/ us in our efforts to isolate the brutal #NoKo regime. https://t.co/43U4T34JgF,9/26/2017,8536,39563,FALSE,9.13E+17,84
Twitter for iPhone,Thank you to our wonderful team @USUN and their families. Keep up the GREAT work! #USA???§???? https://t.co/s7KhlSMEqY,9/26/2017,6359,34145,FALSE,9.13E+17,84
Twitter for iPhone,70 years ago today the National Security Council met for the first time. Great history of advising Presidents-then &amp; now! Thanks NSC Staff!,9/27/2017,8725,54780,FALSE,9.13E+17,84
Twitter for iPhone,Even Usain Bolt from Jamaica one of the greatest runners and athletes of all time showed RESPECT for our National Anthem! ???§???????????ý https://t.co/zkenuAP9RS,9/27/2017,43791,146298,FALSE,9.13E+17,84
Twitter for iPhone,Congratulations to Roy Moore on his Republican Primary win in Alabama. Luther Strange started way back &amp; ran a good race. Roy WIN in Nov!,9/27/2017,3296,12517,FALSE,9.13E+17,84
Twitter for iPhone,Congratulations to Roy Moore on his Republican Primary win in Alabama. Luther Strange started way back &amp; ran a good race. Roy WIN in Dec!,9/27/2017,17659,88267,FALSE,9.13E+17,84
Twitter for iPhone,Spoke to Roy Moore of Alabama last night for the first time. Sounds like a really great guy who ran a fantastic race. He will help to #MAGA!,9/27/2017,13116,62258,FALSE,9.13E+17,84
Twitter for iPhone,Spoke to Jerry Jones of the Dallas Cowboys yesterday. Jerry is a winner who knows how to get things done. Players will stand for Country!,9/27/2017,17292,92200,FALSE,9.13E+17,84
Twitter for iPhone,With one Yes vote in hospital &amp; very positive signs from Alaska and two others (McCain is out) we have the HCare Vote but not for Friday!,9/27/2017,10093,54410,FALSE,9.13E+17,84
Twitter for iPhone,We will have the votes for Healthcare but not for the reconciliation deadline of Friday after which we need 60. Get rid of Filibuster Rule!,9/27/2017,13283,64338,FALSE,9.13E+17,84
Twitter for iPhone,Facebook was always anti-Trump.The Networks were always anti-Trump henceFake News @nytimes(apologized) &amp; @WaPo were anti-Trump. Collusion?,9/27/2017,16482,66773,FALSE,9.13E+17,84
Twitter for iPhone,..But the people were Pro-Trump! Virtually no President has accomplished what we have accomplished in the first 9 months-and economy roaring,9/27/2017,18837,96049,FALSE,9.13E+17,84
Twitter for iPhone,Just arrived in Indianapolis Indiana to make an announcement on #TaxReform! Together we are going to MAKE AMERICA GREAT AGAIN! https://t.co/Dy9UwhkWHL,9/27/2017,10865,58803,FALSE,9.13E+17,84
Media Studio,This is the right TAX CUT @ the RIGHT TIME. We will ALL succeed &amp; grow TOGETHER ƒ?? as one team one people &amp; one American family. #TaxReform https://t.co/rtLWANJjIQ,9/27/2017,14927,61451,FALSE,9.13E+17,84
Twitter for iPhone,It is time to take care of OUR people to rebuild OUR NATION and to fight for OUR GREAT AMERICAN WORKERS! #TaxReform #USA???§???? https://t.co/LsZvHg3got,9/28/2017,17748,75786,FALSE,9.13E+17,84
Twitter for iPhone,Democrats don't want massive tax cuts - how does that win elections? Great reviews for Tax Cut and Reform Bill.,9/28/2017,17703,78830,FALSE,9.13E+17,84
Twitter for iPhone,The electric power grid in Puerto Rico is totally shot. Large numbers of generators are now on Island. Food and water on site.,9/28/2017,17959,86272,FALSE,9.13E+17,84
Media Studio,Welcome back @SteveScalise!#TeamScalise https://t.co/CoRed8rfL2,9/28/2017,14362,66143,FALSE,9.13E+17,84
Twitter for iPhone,FEMA &amp; First Responders are doing a GREAT job in Puerto Rico. Massive food &amp; water delivered. Docks &amp; electric grid dead. Locals trying....,9/28/2017,11022,54607,FALSE,9.14E+17,84
Twitter for iPhone,...really hard to help but many have lost their homes. Military is now on site and I will be there Tuesday. Wish press would treat fairly!,9/28/2017,14258,73750,FALSE,9.14E+17,84
Twitter for iPhone,RT @IvankaTrump: Thank you to the amazing men and women working tirelessly to bring relief to those in need. #PuertoRico #HurricaneMaria htƒ??,9/28/2017,9711,0,TRUE,9.14E+17,84
Twitter for iPhone,RT @billoreilly: Hannity crushing MSNBC at 9. Good for him! Check the No Spin News on https://t.co/rryWmyXe7C. Killing England a huge bestsƒ??,9/28/2017,9920,0,TRUE,9.14E+17,84
Twitter for iPhone,"Puerto Rico is devastated. Phone system electric grid many roads gone. FEMA and First Responders are amazing. Governor said ""great job!""",9/29/2017,13560,65044,FALSE,9.14E+17,85
Twitter for iPhone,RT @GOPChairwoman: The Trump Inaugural Committee is donating $3 million in surplus funds to victims of the latest hurricanes. https://t.coƒ??,9/29/2017,14440,0,TRUE,9.14E+17,85
Twitter for iPhone,GDP was revised upward to 3.1 for last quarter. Many people thought it would be years before that happened. We have just begun!,9/29/2017,22102,91189,FALSE,9.14E+17,85
Twitter for iPhone,"Puerto Rico Governor Ricardo Rossello just stated: ""The Administration and the President every time we've spoken they've delivered......",9/29/2017,15806,67066,FALSE,9.14E+17,85
Twitter for iPhone,...The fact is that Puerto Rico has been destroyed by two hurricanes. Big decisions will have to be made as to the cost of its rebuilding!,9/29/2017,11335,57452,FALSE,9.14E+17,85
Twitter for iPhone,Thank you to FEMA our great Military &amp; all First Responders who are working so hardagainst terrible oddsin Puerto Rico. See you Tuesday!,9/29/2017,14113,72303,FALSE,9.14E+17,85
Twitter for iPhone,RECORD HIGH FOR S &amp; P 500!,9/29/2017,11340,59517,FALSE,9.14E+17,85
Media Studio,This week we came one step closer to reaching the goal of aligning the skills taught in our nationƒ??s classrooms with the jobs of the future. https://t.co/9s1ggeIJJ5,9/29/2017,10362,50093,FALSE,9.14E+17,85
Twitter for iPhone,Thank you @ShopFloorNAM. An honor to be with you today. Great news! Manufacturers report record-high economic optimism in 2017. #TaxReform https://t.co/4sgMWGotOF,9/29/2017,6469,31256,FALSE,9.14E+17,85
Twitter for iPhone,My thoughts are with all those observing Yom Kippur the holiest day of the Jewish year. https://t.co/0LuZCZl29D,9/29/2017,12029,53021,FALSE,9.14E+17,85
Media Studio,Join me for my #WeeklyAddress???§????https://t.co/QeeKnFuHue https://t.co/NnM2jOkEs0,9/29/2017,6411,28982,FALSE,9.14E+17,85
Twitter for iPhone,@IMPDnews @POTUS THANK YOU to the amazing Indianapolis Metropolitan Police Department and all law enforcement officers for all you do 24/7/365! #LESM https://t.co/XFqxbMBEbP,9/29/2017,1524,4459,FALSE,9.14E+17,85
Twitter for iPhone,RT @LouDobbs: #AmericaFirst- @KellyannePolls: The Middle Class &amp; businesses will benefit from @POTUS' historic tax revolution. #Dobbs #MAGAƒ??,9/30/2017,5516,0,TRUE,9.14E+17,85
Twitter for iPhone,RT @FoxNews: TUNE IN: @EricTrump joins @seanhannity TONIGHT at 9p ET on @FoxNews Channel! #Hannityat9 https://t.co/foDzkcAKJe,9/30/2017,2957,0,TRUE,9.14E+17,85
Twitter for iPhone,RT @EricTrump: Congratulations @SeanHannity! Looking forward to being on the show tonight at 9pmET  Hannity beats Maddow - POLITICO https:/ƒ??,9/30/2017,6000,0,TRUE,9.14E+17,85
Twitter for iPhone,RT @Scavino45: POTUS' @realDonaldTrump on Hurricane Response Efforts in #PuertoRico on Instagram part of 9/29/17 Weekly Address.???https://ƒ??,9/30/2017,5593,0,TRUE,9.14E+17,85
Twitter for iPhone,"RT @Scavino45: ""Manufacturer Optimism Hits Record High After #TaxReform Plan Revealed"" https://t.co/RbVmEe4sqq",9/30/2017,4965,0,TRUE,9.14E+17,85
Twitter for iPhone,RT @Scavino45: Under POTUS' @realDonaldTrump ƒ??‹?S&amp;P 500 38th????Record High ƒ??‹?NASDAQ 44th????Record Highƒ??‹?#MakeAmericaGreatAgain???§???? https://t.coƒ??,9/30/2017,8024,0,TRUE,9.14E+17,85
Twitter for iPhone,RT @Scavino45: #USNSComfort en route to #PuertoRico from Norfolk Virginia to support Hurricane Maria relief efforts. ???§???????æ???ú https://t.co/HWƒ??,9/30/2017,7600,0,TRUE,9.14E+17,85
Twitter for iPhone,The Mayor of San Juan who was very complimentary only a few days ago has now been told by the Democrats that you must be nasty to Trump.,9/30/2017,21828,69941,FALSE,9.14E+17,85
Twitter for iPhone,...Such poor leadership ability by the Mayor of San Juan and others in Puerto Rico who are not able to get their workers to help. They....,9/30/2017,15502,56243,FALSE,9.14E+17,85
Twitter for iPhone,...want everything to be done for them when it should be a community effort. 10000 Federal workers now on Island doing a fantastic job.,9/30/2017,15627,68824,FALSE,9.14E+17,85
Twitter for iPhone,The military and first responders despite no electric roads phones etc. have done an amazing job. Puerto Rico was totally destroyed.,9/30/2017,13685,62065,FALSE,9.14E+17,85
Twitter for iPhone,RT @USCGSoutheast: .@USCG crews worked together with the @RedCross @fema and members of local #police #fire and #government to distributƒ??,9/30/2017,8730,0,TRUE,9.14E+17,85
Twitter for iPhone,RT @usairforce: ƒ?­‹? ƒ??#AirForce relief efforts in #PuertoRico &amp; #VirginIslandsƒ?https://t.co/gonmsZusSe,9/30/2017,7423,0,TRUE,9.14E+17,85
Twitter for iPhone,RT @DeptofDefense: VIDEO: Elements of the #DoD and @FEMA are providing humanitarian relief for #PuertoRico ???æ???ú  and #USVI ???¯???? . https://t.co/ƒ??,9/30/2017,7095,0,TRUE,9.14E+17,85
Twitter for iPhone,RT @FLOTUS: Thank you to all who participated in today's discussion on opioid abuse. By talking about it we can start to make a real diffeƒ??,9/30/2017,10892,0,TRUE,9.14E+17,85
Twitter for iPhone,"Fake News CNN and NBC are going out of their way to disparage our great First Responders as a way to ""get Trump."" Not fair to FR or effort!",9/30/2017,20901,80326,FALSE,9.14E+17,85
Twitter for iPhone,I will be going to Puerto Rico on Tuesday with Melania. Will hopefully be able to stop at the U.S. Virgin Islands (people working hard).,9/30/2017,13824,68989,FALSE,9.14E+17,85
Twitter for iPhone,The Fake News Networks are working overtime in Puerto Rico doing their best to take the spirit away from our soldiers and first R's. Shame!,9/30/2017,24633,91112,FALSE,9.14E+17,85
Twitter for iPhone,Despite the Fake News Media in conjunction with the Dems an amazing job is being done in Puerto Rico. Great people!,9/30/2017,16910,76847,FALSE,9.14E+17,85
Twitter for iPhone,The Governor of Puerto Rico Ricardo Rossello is a great guy and leader who is really working hard. Thank you Ricky!,9/30/2017,14056,66359,FALSE,9.14E+17,85
Twitter for iPhone,Just spoke to Governor Kenneth Mapp of the U.S. Virgin Islands who stated that #FEMA and Military are doing a GREAT job! Thank you Governor!,9/30/2017,13429,60555,FALSE,9.14E+17,85
Twitter for iPhone,Congresswoman Jennifer Gonzalez-Colon of Puerto Rico has been wonderful to deal with and a great representative of the people. Thank you!,9/30/2017,12916,62251,FALSE,9.14E+17,85
Twitter for iPhone,To the people of Puerto Rico:Do not believe the #FakeNews!#PRStrong???æ???ú,9/30/2017,16067,63449,FALSE,9.14E+17,85
Twitter for iPhone,My Administration Governor @RicardoRossello and many others are working together to help the people of Puerto Rico in every way...,9/30/2017,9861,46164,FALSE,9.14E+17,85
Twitter for iPhone,@ricardorossello ......#FakeNews critics are working overtime but we're getting great marks from the people that truly matter! #PRStrong???æ???ú,9/30/2017,7855,35928,FALSE,9.14E+17,85
Twitter for iPhone,We must all be united in offering assistance to everyone suffering in Puerto Rico and elsewhere in the wake of this terrible disaster.,9/30/2017,13930,67512,FALSE,9.14E+17,85
Twitter for iPhone,Results of recovery efforts will speak much louder than complaints by San Juan Mayor. Doing everything we can to help great people of PR!,9/30/2017,17587,77057,FALSE,9.14E+17,85
Twitter for iPhone,I will be in PR on Tues. to further ensure we continue doing everything possible to assist &amp; support the people in their time of great need.,9/30/2017,13067,66915,FALSE,9.14E+17,85
Twitter for iPhone,Very important that NFL players STAND tomorrow and always for the playing of our National Anthem. Respect our Flag and our Country!,9/30/2017,27313,124557,FALSE,9.14E+17,85
Media Studio,Because of #FakeNews my people are not getting the credit they deserve for doing a great job. As seen here they are ALL doing a GREAT JOB! https://t.co/1ltW2t3rwy,9/30/2017,32181,93394,FALSE,9.14E+17,85
Twitter for iPhone,In analyzing the Alabama Primary race Fake News always fails to mention that the candidate I endorsed went up MANY points after Election!,9/30/2017,294,1416,FALSE,9.14E+17,85
Twitter for iPhone,In analyzing the Alabama Primary raceFAKE NEWS always fails to mention that the candidate I endorsed went up MANY points after endorsement!,9/30/2017,7441,47140,FALSE,9.14E+17,85
Twitter for iPhone,19000 RESPECTING our National Anthem! #StandForOurAnthem???§???? https://t.co/czutyGaMQV,10/1/2017,31731,116343,FALSE,9.14E+17,85
Twitter for iPhone,RT @SLandinSoCal: When you kneel for our #NationalAnthem you aren't protesting a specific issue you are protesting our Nation and EVERYTHƒ??,10/1/2017,17122,0,TRUE,9.14E+17,85
Twitter for iPhone,We have done a great job with the almost impossible situation in Puerto Rico. Outside of the Fake News or politically motivated ingrates...,10/1/2017,18284,81847,FALSE,9.14E+17,85
Twitter for iPhone,...people are now starting to recognize the amazing work that has been done by FEMA and our great Military. All buildings now inspected.....,10/1/2017,16034,80679,FALSE,9.14E+17,85
Twitter for iPhone,...for safety. Thank you to the Governor of P.R. and to all of those who are working so closely with our First Responders. Fantastic job!,10/1/2017,14147,75918,FALSE,9.14E+17,85
